{
  "format": "oil-author",
  "version": 2,
  "engine": "2.0.0-dev.4",
  "seed": 817,
  "aspect": [
    2,
    1
  ],
  "ground": [
    0.68,
    0.65,
    0.59
  ],
  "catalog": {
    "presets": [
      {
        "contact": "flat",
        "depletion": 0.6499999761581421,
        "id": "loaded-flat",
        "mode": 0,
        "name": "Loaded flat",
        "paint": {
          "blob": 0.3199999928474426,
          "body": 0.9700000286102295,
          "dropout": 0.03500000014901161,
          "flatten": 0.75,
          "furrow": 0.15000000596046448,
          "grain": 0.03999999910593033,
          "hardness": 0.800000011920929,
          "hgain": 0.550000011920929,
          "levee": 0.07999999821186066,
          "load": 1,
          "marble": 0,
          "nb": 16,
          "opacity": 0.9900000095367432,
          "pickup": 0.014999999664723873,
          "ragged": 0.6499999761581421,
          "release": 0.30000001192092896,
          "ridge": 0.4000000059604645,
          "splay": 0.3499999940395355,
          "stiff": 0.4000000059604645,
          "streak": 0.2199999988079071,
          "streakMix": 0.800000011920929,
          "vdry": 0.36000001430511475
        },
        "pressureProfile": [
          0.550000011920929,
          1,
          0.18000000715255737
        ],
        "status": "candidate",
        "variation": 0.10000000149011612,
        "width": [
          0.0020000000949949026,
          0.024000000208616257,
          0.11999999731779099
        ],
        "widthProfile": [
          0.47999998927116394,
          1,
          0.10000000149011612
        ]
      },
      {
        "contact": "round",
        "depletion": 0.30000001192092896,
        "id": "rounded-dab",
        "mode": 0,
        "name": "Rounded dab",
        "paint": {
          "blob": 0.4000000059604645,
          "body": 0.9700000286102295,
          "dropout": 0.03500000014901161,
          "flatten": 0.75,
          "furrow": 0.15000000596046448,
          "grain": 0.03999999910593033,
          "hardness": 0.800000011920929,
          "hgain": 0.75,
          "levee": 0.07999999821186066,
          "load": 1,
          "marble": 0,
          "nb": 16,
          "opacity": 0.9900000095367432,
          "pickup": 0.014999999664723873,
          "ragged": 0.800000011920929,
          "release": 0.30000001192092896,
          "ridge": 0.4000000059604645,
          "splay": 0.3499999940395355,
          "stiff": 0.4000000059604645,
          "streak": 0.2199999988079071,
          "streakMix": 0.800000011920929,
          "vdry": 0.36000001430511475
        },
        "pressureProfile": [
          0.550000011920929,
          1,
          0.18000000715255737
        ],
        "status": "candidate",
        "variation": 0.14000000059604645,
        "width": [
          0.0020000000949949026,
          0.029999999329447746,
          0.11999999731779099
        ],
        "widthProfile": [
          0.029999999329447746,
          1,
          0.014999999664723873
        ]
      },
      {
        "contact": "flat",
        "depletion": 1.2000000476837158,
        "id": "dry-drag",
        "mode": 0,
        "name": "Dry drag",
        "paint": {
          "blob": 0.3199999928474426,
          "body": 0.11999999731779099,
          "dropout": 0.12999999523162842,
          "flatten": 0.75,
          "furrow": 0.15000000596046448,
          "grain": 0.03500000014901161,
          "hardness": 0.800000011920929,
          "hgain": 0.550000011920929,
          "levee": 0.07999999821186066,
          "load": 0.6200000047683716,
          "marble": 0,
          "nb": 16,
          "opacity": 0.9900000095367432,
          "pickup": 0.014999999664723873,
          "ragged": 0.8999999761581421,
          "release": 0.30000001192092896,
          "ridge": 0.4000000059604645,
          "splay": 0.3499999940395355,
          "stiff": 0.4000000059604645,
          "streak": 0.4000000059604645,
          "streakMix": 0.800000011920929,
          "vdry": 0.4399999976158142
        },
        "pressureProfile": [
          0.8500000238418579,
          0.8999999761581421,
          0.11999999731779099
        ],
        "status": "candidate",
        "variation": 0.10000000149011612,
        "width": [
          0.0020000000949949026,
          0.026000000536441803,
          0.11999999731779099
        ],
        "widthProfile": [
          0.47999998927116394,
          1,
          0.10000000149011612
        ]
      },
      {
        "contact": "flat",
        "depletion": 0.6000000238418579,
        "id": "scumble",
        "mode": 1,
        "name": "Scumble",
        "paint": {
          "blob": 0.3199999928474426,
          "body": 0.9200000166893005,
          "dropout": 0.02500000037252903,
          "flatten": 0.75,
          "furrow": 0.15000000596046448,
          "grain": 0,
          "hardness": 0.800000011920929,
          "hgain": 0.44999998807907104,
          "levee": 0.07999999821186066,
          "load": 0.949999988079071,
          "marble": 0,
          "nb": 16,
          "opacity": 1,
          "pickup": 0.009999999776482582,
          "ragged": 0.6499999761581421,
          "release": 0.30000001192092896,
          "ridge": 0.4000000059604645,
          "splay": 0.3499999940395355,
          "stiff": 0.4000000059604645,
          "streak": 0.2199999988079071,
          "streakMix": 0.800000011920929,
          "vdry": 0.36000001430511475
        },
        "pressureProfile": [
          0.550000011920929,
          1,
          0.18000000715255737
        ],
        "status": "candidate",
        "variation": 0.10000000149011612,
        "width": [
          0.003000000026077032,
          0.03200000151991844,
          0.11999999731779099
        ],
        "widthProfile": [
          0.47999998927116394,
          1,
          0.10000000149011612
        ]
      },
      {
        "contact": "flat",
        "depletion": 0.30000001192092896,
        "id": "impasto-accent",
        "mode": 0,
        "name": "Impasto accent",
        "paint": {
          "blob": 0.4000000059604645,
          "body": 0.9700000286102295,
          "dropout": 0.03500000014901161,
          "flatten": 0.5,
          "furrow": 0.15000000596046448,
          "grain": 0.03999999910593033,
          "hardness": 0.800000011920929,
          "hgain": 1.5,
          "levee": 0.07999999821186066,
          "load": 1,
          "marble": 0,
          "nb": 16,
          "opacity": 0.9900000095367432,
          "pickup": 0.014999999664723873,
          "ragged": 0.6499999761581421,
          "release": 0.30000001192092896,
          "ridge": 0.550000011920929,
          "splay": 0.3499999940395355,
          "stiff": 0.550000011920929,
          "streak": 0.2199999988079071,
          "streakMix": 0.800000011920929,
          "vdry": 0.36000001430511475
        },
        "pressureProfile": [
          0.550000011920929,
          1,
          0.18000000715255737
        ],
        "status": "candidate",
        "variation": 0.10000000149011612,
        "width": [
          0.0020000000949949026,
          0.017999999225139618,
          0.07999999821186066
        ],
        "widthProfile": [
          0.47999998927116394,
          1,
          0.10000000149011612
        ]
      },
      {
        "contact": "point",
        "depletion": 0.4000000059604645,
        "id": "fine-detail",
        "mode": 0,
        "name": "Fine detail",
        "paint": {
          "blob": 0.3199999928474426,
          "body": 0.9700000286102295,
          "dropout": 0.004999999888241291,
          "flatten": 0.75,
          "furrow": 0.15000000596046448,
          "grain": 0.014999999664723873,
          "hardness": 0.800000011920929,
          "hgain": 0.3499999940395355,
          "levee": 0.07999999821186066,
          "load": 1,
          "marble": 0,
          "nb": 7,
          "opacity": 0.9900000095367432,
          "pickup": 0.014999999664723873,
          "ragged": 0.11999999731779099,
          "release": 0.30000001192092896,
          "ridge": 0.4000000059604645,
          "splay": 0,
          "stiff": 0.1599999964237213,
          "streak": 0.2199999988079071,
          "streakMix": 0.800000011920929,
          "vdry": 0.36000001430511475
        },
        "pressureProfile": [
          0.550000011920929,
          1,
          0.18000000715255737
        ],
        "status": "candidate",
        "variation": 0.014999999664723873,
        "width": [
          0.0005000000237487257,
          0.004000000189989805,
          0.02500000037252903
        ],
        "widthProfile": [
          0.20000000298023224,
          1,
          0.019999999552965164
        ]
      },
      {
        "contact": "flat",
        "depletion": 0.699999988079071,
        "id": "wet-mixing",
        "mode": 0,
        "name": "Wet mixing",
        "paint": {
          "blob": 0.3199999928474426,
          "body": 0.800000011920929,
          "dropout": 0.03500000014901161,
          "flatten": 0.8500000238418579,
          "furrow": 0.15000000596046448,
          "grain": 0.03999999910593033,
          "hardness": 0.800000011920929,
          "hgain": 0.30000001192092896,
          "levee": 0.07999999821186066,
          "load": 0.6499999761581421,
          "marble": 0,
          "nb": 12,
          "opacity": 0.9900000095367432,
          "pickup": 0.699999988079071,
          "ragged": 0.6499999761581421,
          "release": 0.25999999046325684,
          "ridge": 0.4000000059604645,
          "splay": 0.3499999940395355,
          "stiff": 0.4000000059604645,
          "streak": 0.2199999988079071,
          "streakMix": 1,
          "vdry": 0.36000001430511475
        },
        "pressureProfile": [
          0.550000011920929,
          1,
          0.18000000715255737
        ],
        "status": "candidate",
        "variation": 0.10000000149011612,
        "width": [
          0.0020000000949949026,
          0.02500000037252903,